codigo,descricao,codigo_grupo
9650,REFINADOS E PRODUTOS SEMI-ACABADOS DE  METAIS  BÁSICOS  NÃO FERROSOS                                                    ,96
9660,METAIS PRECIOSOS EM SUAS FORMAS PRIMÁRIAS                                                                               ,96
9670,SUCATA DE FERRO E DE AÇO                                                                                                ,96
9680,SUCATA DE METAIS NÃO FERROSOS                                                                                           ,96
9905,"CARTAZES, MOSTRUÁRIOS E PLACAS DE IDENTIFICAÇÃO                                                                         ",99
9910,ARTIGOS DE JOALHERIA                                                                                                    ,99
9915,ARTIGOS PARA COLECIONADORES E/OU HISTÓRICOS                                                                             ,99
9920,ARTIGOS PARA FUMANTES                                                                                                   ,99
9925,EQUIPAMENTOS E ARTIGOS RELIGIOSOS                                                                                       ,99
9930,EQUIPAMENTOS E ARTIGOS MORTUÁRIOS E DE CEMITÉRIO                                                                        ,99
9998,SERVICO                                                                                                                 ,99
9999,ITENS DIVERSOS                                                                                                          ,99
